{
  "$schema": "https://json-schema.org/draft/2020-12/schema",
  "$id": "https://stamped.energy/schemas/pipeline-run.v1.json",
  "title": "PipelineRun",
  "description": "L5 staff-only manual perception pipeline run (ADR-029). Never send to L6.",
  "type": "object",
  "required": [
    "schema_version",
    "pipeline_run_id",
    "org_id",
    "plant_id",
    "status",
    "trigger",
    "created_at"
  ],
  "properties": {
    "schema_version": {
      "type": "string",
      "const": "1.0.0"
    },
    "pipeline_run_id": { "type": "string", "minLength": 1 },
    "org_id": { "type": "string", "minLength": 1 },
    "plant_id": { "type": "string", "minLength": 1 },
    "status": {
      "type": "string",
      "enum": [
        "queued",
        "detecting",
        "compiling",
        "completed",
        "failed",
        "partial"
      ]
    },
    "trigger": {
      "type": "object",
      "required": ["kind", "actor", "reason"],
      "properties": {
        "kind": {
          "type": "string",
          "enum": ["manual_staff", "ops_recompute"]
        },
        "actor": { "type": "string", "minLength": 1 },
        "reason": { "type": "string", "minLength": 1 },
        "idempotency_key": { "type": "string" }
      },
      "additionalProperties": false
    },
    "as_of": { "type": "string", "format": "date-time" },
    "detection_run_id": { "type": "string" },
    "finding_ids": {
      "type": "array",
      "items": { "type": "string" }
    },
    "compile_trace_ids": {
      "type": "array",
      "items": { "type": "string" }
    },
    "emitted_prescription_ids": {
      "type": "array",
      "items": { "type": "string" }
    },
    "error": { "type": "string" },
    "created_at": { "type": "string", "format": "date-time" },
    "updated_at": { "type": "string", "format": "date-time" },
    "completed_at": { "type": ["string", "null"], "format": "date-time" }
  },
  "additionalProperties": false
}
