{
  "schema_version": "1.0.0",
  "pipeline_run_id": "prun-2026-08-20-manual-01",
  "org_id": "org_acme",
  "plant_id": "plant_ghaziabad_1",
  "status": "completed",
  "trigger": {
    "kind": "manual_staff",
    "actor": "staff@stamped.energy",
    "reason": "Manual perception after compressor house walkthrough",
    "idempotency_key": "idem-2026-08-20-001"
  },
  "as_of": "2026-08-20T09:15:00Z",
  "detection_run_id": "drun-2026-08-20-01",
  "finding_ids": ["f-2026-07-08-0042"],
  "compile_trace_ids": [
    "ctr-2026-08-18-comp2-01",
    "ctr-2026-08-20-comp2-stale"
  ],
  "emitted_prescription_ids": ["rx-2026-08-18-comp2"],
  "created_at": "2026-08-20T09:15:01Z",
  "updated_at": "2026-08-20T09:16:40Z",
  "completed_at": "2026-08-20T09:16:40Z"
}
